4281507270,JUNIOR DATA ENGINEER (IT),"Milan, Lombardy, Italy",5 days ago,Plenitude,"Potrai entrare a far parte di una global energy tech company impegnata a raggiungere la neutralità carbonica entro il 2050, che punta sulle competenze e sulla crescita delle persone investendo risorse nella ricerca di soluzioni tecnologiche innovative .Come Junior Data Engineer, farai parte di. In particolare, all’interno del tuo teamcollaborerai con gli altri esperti del mondo dati (Data Scientist, Data Analyst, BI Expert) per costruire team multifunzionali, al fine di creare business value dai dati, lavorando alla diffusione in azienda dell’utilizzo dei dati, degli analytics e dei data products.MilanoPromuoviamo forme flessibili di lavoro, offrendo opzioni di Smart working ed orari flessibili al fine di sostenere il maggior equilibrio tra vita professionale e personale.I candidati ritenuti di maggior interesse saranno contattati per le fasi successive.Per informazioni sule consigli utili puoi cliccare., società controllata da Eni, è presente sul mercato con un modello di business distintivo che integra la produzione da rinnovabili, la vendita di energia e le soluzioni energetiche e un’ampia rete di punti di ricarica per veicoli elettrici.Fornisce energia a 10 milioni di clienti europei nel mercato retail con l’obiettivo di raggiungere 11,5 milioni di clienti entro il 2027. La Società ha l’obiettivo di raggiungere oltre 8 GW di capacità rinnovabile installata al 2027 e oltre 15 GW al 2030. Nel settore della mobilità elettrica possiede una rete di migliaia di punti di ricarica che sarà ampliata sia in Italia che in Europa con l’obiettivo di raggiungere 40.000 punti entro il 2027. Inoltre, è leader in Italia nella generazione distribuita da impianti fotovoltaici di piccola taglia.Plenitude è una Società Benefit, che integra, all’interno del proprio Statuto, l’obiettivo di avere un impatto positivo sulle persone, le comunità e l’ambiente e si inquadra nel più ampio impegno di Eni volto a creare valore attraverso la transizione energetica. Presente in diversi Paesi del mondo, Plenitude ha l’obiettivo di azzerare le emissioni nette di CO2 Scope1, 2 e 3 entro il 2040 e grazie a una proposta integrata e diversificata, di fornire energia decarbonizzata a tutti i clienti.",https://it.linkedin.com/jobs/view/junior-data-engineer-it-at-plenitude-4281507270?trk=public_jobs_topcard-title,https://www.linkedin.com/company/eni-plenitude?trk=public_jobs_topcard-org-name,Over 200 applicants,Oil and Gas,Full-time,Information Technology,Mid-Senior level,European Union,Data engineer
4280228496,Junior Data Engineer Graduate Program,"Lisboa, Lisbon, Portugal",4 days ago,Richemont,"We are seeking an enthusiastic and aspiring Junior Data Engineer to join our growing data team. In this entry-level role, you will have the opportunity to learn and contribute to building, maintaining, and optimizing our data infrastructure, with a strong emphasis on DataOps principles. You will work closely with data analysts and other engineers, learning to ensure the reliability, scalability, and security of our data pipelines.",https://pt.linkedin.com/jobs/view/junior-data-engineer-graduate-program-at-richemont-4280228496?trk=public_jobs_topcard-title,https://ch.linkedin.com/company/richemont?trk=public_jobs_topcard-org-name,Over 200 applicants,Retail Luxury Goods and Jewelry,Temporary,Information Technology,Entry level,European Union,Data engineer
4292392661,Data Engineer,Bucharest Metropolitan Area,6 days ago,Deutsche Bank,,https://ro.linkedin.com/jobs/view/data-engineer-at-deutsche-bank-4292392661?trk=public_jobs_topcard-title,https://de.linkedin.com/company/deutsche-bank?trk=public_jobs_topcard-org-name,,Financial Services and Banking,Full-time,Engineering,Mid-Senior level,European Union,Data engineer
4273233182,Junior Data Engineer,"Athens, Attiki, Greece",2 weeks ago,EY,"At EY, we’re all in to shape your future with confidence. We’ll help you succeed in a globally connected powerhouse of diverse teams and take your career wherever you want it to go.Join EY and help to build a better working world.Being part of EY in Greece means being part of a team which has been announced asfor the third consecutive year, certified as afor a second year in a row, and awarded asfor the first time!At EY, we’ll develop you withand equip you withthrough coaching and training programs as well as the use of. We’ll fuel you and your extraordinary talents in aof globally connected teamsJoin our continuously growing team, which employs, to experience great flexibility under ouracross our offices in Athens, Patras, and Thessaloniki and help to.Modern technology produces more data than ever before, but also provides the tools to store, organize, analyze and share this data, resulting in new opportunities and substantiated business insights in support of new and deeper insights and more informed decision making. EY delivers leading services and solutions in the area of big data, business intelligence and data engineering built on a blend of tools and custom-developed methods.As part of our AI & Data team of the Technology Consulting practice, you will work with multi-disciplinary teams to support clients in a wide range of data initiatives aiming to generate and present new, useful and actionable insights. You will have the opportunity to work and take responsibilities in challenging engagements, gaining exposure to clients in various sectors both in Greece and abroad.Are you ready to shape your future with confidence? Apply today.To help create an equitable and inclusive experience during the recruitment process, please inform us as soon as possible about any disability-related adjustments or accommodations you may need.| Building a better working worldEY is building a better working world by creating new value for clients, people, society and the planet, while building trust in capital markets.Enabled by data, AI and advanced technology, EY teams help clients shape the future with confidence and develop answers for the most pressing issues of today and tomorrow.EY teams work across a full spectrum of services in assurance, consulting, tax, strategy and transactions. Fueled by sector insights, a globally connected, multi-disciplinary network and diverse ecosystem partners, EY teams can provide services in more than 150 countries and territories.#betterworkingworld",https://gr.linkedin.com/jobs/view/junior-data-engineer-at-ey-4273233182?trk=public_jobs_topcard-title,https://uk.linkedin.com/company/ernstandyoung?trk=public_jobs_topcard-org-name,Over 200 applicants,Professional Services,Full-time,Information Technology,Entry level,European Union,Data engineer
4290881764,DATA ENGINEER,"Paris, Île-de-France, France",1 week ago,STATION F,"À proposKraaft a pour mission d’aider les entreprises du BTP grâce à l’intelligence artificielle, via une application de suivi de chantier simple à utiliser sur le terrain.Dans un monde où le numérique semble être partout, on oublie parfois que 80% des employés ne travaillent pas derrière un bureau ! Beaucoup de personnes sur le terrain n’ont pas d’e-mails professionnels et n’ont pas de bonne connexion internet. Sur chantier, taper un message avec des gants ou sous la pluie complique encore les choses, et la communication est parfois difficile avec les ingénieurs travaux au bureau.Kraaft comble ce fossé ! Première “super app” pour chantiers, elle simplifie la vie des ouvriers en intégrant discussions, plans, photos, rapports, et workflows d’IA dans une seule app facile à utiliser sur le terrain.Avec plus de 1 000 entreprises clientes dans 7 pays, et une récente levée de fonds de 13M début 2025, Kraaft a su convaincre des géants du BTP comme VINCI et Bouygues.Dans ce contexte, nous cherchons le premier Data Engineer de Kraaft, pour porter la vision Data de notre entreprise ! et mieux répondre aux enjeux de notre croissance.Descriptif du posteEn tant que, tu vas poser les fondations de notre stack data. Aujourd’hui, nos données sont riches (métier, usage, produit), mais sous-exploitées. Ton objectif ? Nous aider à les structurer, les rendre accessibles et les transformer en levier stratégique.Tu travailleras au sein de la team Tech & Produit, main dans la main avec les devs, le produit, et les équipes métier (Sales, Ops, CS). Tu seras un maillon clé dans la mise en place de notre future plateforme data.Profil recherché❤️ Pourquoi nous rejoindre ?Process de recrutementInformations complémentaires",https://fr.linkedin.com/jobs/view/data-engineer-at-station-f-4290881764?trk=public_jobs_topcard-title,https://fr.linkedin.com/company/stationf?trk=public_jobs_topcard-org-name,,"Technology, Information and Internet",Full-time,Information Technology,Entry level,European Union,Data engineer
4281709044,Junior Data Engineer,"Lisbon, Portugal",3 weeks ago,Next Engineering,,https://pt.linkedin.com/jobs/view/junior-data-engineer-at-next-engineering-4281709044?trk=public_jobs_topcard-title,https://pt.linkedin.com/company/yournextengineering?trk=public_jobs_topcard-org-name,,Information Technology & Services,Full-time,Information Technology,Associate,European Union,Data engineer
4234705599,Data Engineer,"Amsterdam, North Holland, Netherlands",2 weeks ago,Samba TV,,https://nl.linkedin.com/jobs/view/data-engineer-at-samba-tv-4234705599?trk=public_jobs_topcard-title,https://www.linkedin.com/company/sambatv?trk=public_jobs_topcard-org-name,,"Technology, Information and Internet",Full-time,Information Technology,Not Applicable,European Union,Data engineer
4295028421,Data Engineer,"Zielona Góra, Lubuskie, Poland",17 hours ago,Amazing AUCTANE,"At Auctane, we are united by a passion to help businesses deliver — whatever their size, wherever they are, and however they operate. We make it possible for businesses to meet the ever-changing requirements of their industry and customer expectations. Auctane products enable hundreds of thousands of businesses to annually mail and ship billions of items — over $200 billion worth — to recipients around the globe.The Auctane family of mailing and shipping software products includes ShipStation, Stamps.com, ShipStation API, Metapack, GlobalPost, and Packlink. Our partners include Amazon, UPS, USPS, eBay, BigCommerce, Shopify, WooCommerce, and Walmart.Our valuesWin as One. Delight Customers. Deliver Great Outcomes.This is a hands-on role for a Data Engineer sitting within the Data Products team. In this role, you will have an enormous impact on the design, implementation, and maintenance of existing and greenfield customer-facing data products. Data is key to Auctane's strategy. We work at a scale pace and with the latest architecture patterns and tech. We process thousands of events per second, and our massive dataset keeps growing at a staggering pace. We keep improving our data platform and data engineering stack to accommodate growth, enable novel solutions, and provide the best service to our customers. We have a flat and open engineering culture where data & evidence beat opinion and hierarchy, backed by honest discussions. We passionately believe in forming autonomous, cross-functional teams who are empowered to deliver our ambitious strategy. Energy and passion for our business and customers are a part of the Auctane culture – and we love working with like-minded people.What will you be doing?What are we looking for?What will make you stand out?Tech stackPython SQL Amazon Web Services C# .NETWhat do we offer?",https://pl.linkedin.com/jobs/view/data-engineer-at-amazing-auctane-4295028421?trk=public_jobs_topcard-title,https://pl.linkedin.com/company/auctane-poland?trk=public_jobs_topcard-org-name,Be among the first 25 applicants,Software Development,Full-time,Information Technology,Entry level,European Union,Data engineer
4291112012,Data engineer JR,"Madrid, Community of Madrid, Spain",5 days ago,Solarig,,https://es.linkedin.com/jobs/view/data-engineer-jr-at-solarig-4291112012?trk=public_jobs_topcard-title,https://es.linkedin.com/company/solarig?trk=public_jobs_topcard-org-name,Over 200 applicants,Renewable Energy Power Generation,Full-time,Information Technology,Associate,European Union,Data engineer
4293766905,Data Engineer,Ireland,2 days ago,Ardanis,"Ardanis is currently looking for a Data Engineer to support a client in the hospitality sector in the UK. The role involves collaborating with a small, non-technical internal team to build and refactor a data warehouse, streamline reporting, and improve insights through Power BI.If you're ready to shape the future, join us!",https://ie.linkedin.com/jobs/view/data-engineer-at-ardanis-4293766905?trk=public_jobs_topcard-title,https://ie.linkedin.com/company/ardanis-technologies-limited?trk=public_jobs_topcard-org-name,Over 200 applicants,IT Services and IT Consulting,Full-time,Other,Entry level,European Union,Data engineer
3982462774,Data Engineer (L5),United States,4 days ago,Netflix,"Netflix is one of the world's leading entertainment services, with over 300 million paid memberships in over 190 countries enjoying TV series, films and games across a wide variety of genres and languages. Members can play, pause and resume watching as much as they want, anytime, anywhere, and can change their plans at any time.Netflix is revolutionizing how shows and movies are produced, pushing technological boundaries to efficiently deliver streaming video at a massive scale over the internet, and continuously improving the end-to-end user experience with Netflix across their member journey.We pride ourselves on using data to inform our decision-making as we work towards our mission. This requires curating data across various domains such as Ads, Games, Growth, Finance, Product, Content, and Studio. All of this data collection and curation is made possible thanks to the amazing Data Engineers of Netflix who bring this data to life.Data Engineering at Netflix is a role that requires building systems to process data efficiently and modeling the data to power analytics. These solutions can range from batch data pipelines that bring business metrics to life to real-time processing services that integrate with our core product features. In addition, we require our Data Engineers to have a rich understanding of large distributed systems on which our data solutions rely. Candidates should have knowledge across several of these skill sets and usually need to be deep in at least one. As a Data Engineer, you also need to have strong communication skills since you will need to collaborate with business, engineering, and data science teams to enable a culture of learning. Learn more about the work of data engineers at Netflix.: We are considering candidates who are willing to relocate to Los Gatos, California, as well as fully-remote candidates (remote in the US with occasional visits to Los Gatos) depending on the team your skills are most aligned with.Our compensation structure consists solely of an annual salary; we do not have bonuses. You choose each year how much of your compensation you want in salary versus stock options. To determine your personal top of market compensation, we rely on market indicators and consider your specific job family, background, skills, and experience to determine your compensation in the market range. The range for is $170,000 - $720,000.Netflix provides comprehensive benefits including Health Plans, Mental Health support, a 401(k) Retirement Plan with employer match, Stock Option Program, Disability Programs, Health Savings and Flexible Spending Accounts, Family-forming benefits, and Life and Serious Injury Benefits. We also offer paid leave of absence programs. Full-time hourly employees accrue 35 days annually for paid time off to be used for vacation, holidays, and sick paid time off. Full-time salaried employees are immediately entitled to flexible time off. See more detail about our Benefits here.Netflix is a unique culture and environment. Learn more here.Inclusion is a Netflix value and we strive to host a meaningful interview experience for all candidates. If you want an accommodation/adjustment for a disability or any other reason during the hiring process, please send a request to your recruiting partner.We are an equal-opportunity employer and celebrate diversity, recognizing that diversity builds stronger teams. We approach diversity and inclusion seriously and thoughtfully. We do not discriminate on the basis of race, religion, color, ancestry, national origin, caste, sex, sexual orientation, gender, gender identity or expression, age, disability, medical condition, pregnancy, genetic makeup, marital status, or military service.Job is open for no less than 7 days and will be removed when the position is filled.",https://www.linkedin.com/jobs/view/data-engineer-l5-at-netflix-3982462774?trk=public_jobs_topcard-title,https://www.linkedin.com/company/netflix?trk=public_jobs_topcard-org-name,Over 200 applicants,Entertainment Providers,Full-time,Other,Not Applicable,United States,Data engineer
3989284331,Data Engineer (L5) - Ads,United States,1 week ago,Netflix,"Netflix is one of the world's leading entertainment services, with 283 million paid memberships in over 190 countries enjoying TV series, films and games across a wide variety of genres and languages. Members can play, pause and resume watching as much as they want, anytime, anywhere, and can change their plans at any time.Netflix is the world's leading internet entertainment service with over 220+ million memberships in over 190 countries enjoying TV series, documentaries and feature films across a wide variety of genres and languages. And as of November 2022 we added an advertisement branch to our business, making Netflix service accessible to an even broader member base with ad-supported plans!Ads Data Engineering team sits at the core of building a data ecosystem that will power Netflix’ understanding and decision making about what impact ads have on our business. This team’s main focus is to build rich, connected, and easily accessible data products about ad inventories, forecasting, targeting, ad serving, pacing and much more. We are looking for passionale, mature, and curious software engineers with strong data intuition, analytical mindset and ad ecosystem experience, to contribute to the team’s impact in a quickly evolving.Our compensation structure consists solely of an annual salary; we do not have bonuses. You choose each year how much of your compensation you want in salary versus stock options. To determine your personal top of market compensation, we rely on market indicators and consider your specific job family, background, skills, and experience to determine your compensation in the market range. The range for this role is $170,000 - $720,000.Netflix provides comprehensive benefits including Health Plans, Mental Health support, a 401(k) Retirement Plan with employer match, Stock Option Program, Disability Programs, Health Savings and Flexible Spending Accounts, Family-forming benefits, and Life and Serious Injury Benefits. We also offer paid leave of absence programs. Full-time hourly employees accrue 35 days annually for paid time off to be used for vacation, holidays, and sick paid time off. Full-time salaried employees are immediately entitled to flexible time off. See more detail about our Benefits here.Inclusion is a Netflix value and we strive to host a meaningful interview experience for all candidates. If you want an accommodation/adjustment for a disability or any other reason during the hiring process, please send a request to your recruiting partner.We are an equal-opportunity employer and celebrate diversity, recognizing that diversity builds stronger teams. We approach diversity and inclusion seriously and thoughtfully. We do not discriminate on the basis of race, religion, color, ancestry, national origin, caste, sex, sexual orientation, gender, gender identity or expression, age, disability, medical condition, pregnancy, genetic makeup, marital status, or military service.Job is open for no less than 7 days and will be removed when the position is filled.",https://www.linkedin.com/jobs/view/data-engineer-l5-ads-at-netflix-3989284331?trk=public_jobs_topcard-title,https://www.linkedin.com/company/netflix?trk=public_jobs_topcard-org-name,Over 200 applicants,Entertainment Providers,Full-time,Other,Not Applicable,United States,Data engineer
4290872912,Data Engineer,"San Francisco, CA",1 week ago,Asana,"As part of the Enterprise Data & Intelligence (EDI) team, you will play a key role in enabling company-wide, data-informed decision-making. Our business and product teams rely on our data platforms and products to analyze and optimize adoption, growth, and revenue.This role blends technical expertise with strategic collaboration and business acumen. As an individual contributor, you will blend your data and GTM skills to influence the best outcomes for Asana — guiding technical decisions, learning from teammates, and partnering with stakeholders across Asana's Sales Team to deliver robust, scalable data solutions. You will also influence the architecture and evolution of our data platform to ensure its reliability, performance, and usability.This role is based in our San Francisco with an office-centric hybrid scheduleAlong with most Asanas, you’ll work from this office in person on Mondays, Tuesdays, and Thursdays. Most Asanas have the option to work from home on Wednesdays and Fridays. If you're interviewing for this role, your Talent Acquisition Partner will share more about the in-office requirements.Our comprehensive compensation package plays a big part in how we recognize you for the impact you have on our path to achieving our mission. We believe that compensation should be reflective of the value you create relative to the market value of your role. To ensure pay is fair and not impacted by biases, we're committed to looking at market value which is why we check ourselves and conduct a yearly pay equity audit.For this role, the estimated base salary range is between $146,000-186,000. The actual base salary will vary based on various factors, including market and individual qualifications objectively assessed during the interview process. The listed range above is a guideline, and the base salary range for this role may be modified.In addition to base salary, your compensation package may include additional components such as equity, sales incentive pay (for most sales roles), and benefits. If you're interviewing for this role, speak with your Talent Acquisition Partner to learn more about the total compensation and benefits for this role.We strive to provide equitable and competitive benefits packages that support our employees worldwide and include:These are just some of the benefits we offer, and benefits may vary based on role, country, and local regulations. If you're interviewing for this role, speak with your Talent Acquisition Partner to learn more about the total compensation and benefits for this role.Asana helps teams orchestrate their work, from small projects to strategic initiatives. Millions of teams around the world rely on Asana to achieve their most important goals, faster. Asana has been named a Top 10 Best Workplace for 5 years in a row, is Fortune's #1 Best Workplace in the Bay Area, and one of Glassdoor’s and Inc.’s Best Places to Work. After spending more than a year physically distanced, Team Asana is safely and mindfully returning to in-person collaboration, incorporating flexibility that adds hybrid elements to our office-centric culture . With 11+ offices all over the world, we are always looking for individuals who care about building technology that drives positive change in the world and a culture where everyone feels that they belong.We believe in supporting people to do their best work and thrive, and building a diverse, equitable, and inclusive company is core to our mission. Our goal is to ensure that Asana upholds an inclusive environment where all people feel that they are equally respected and valued, whether they are applying for an open position or working at the company. We provide equal employment opportunities to all applicants without regard to race, color, religion, age, sex, national origin, disability status, genetics, protected veteran status, sexual orientation, gender identity or expression, or any other characteristic protected by law. We also comply with the San Francisco Fair Chance Ordinance and similar laws in other locations.",https://www.linkedin.com/jobs/view/data-engineer-at-asana-4290872912?trk=public_jobs_topcard-title,https://www.linkedin.com/company/asana?trk=public_jobs_topcard-org-name,Over 200 applicants,Software Development,Full-time,Information Technology,Associate,United States,Data engineer
